{
 "schema_version": "1.0.0",
 "id": "muster-07",
 "muster": "7",
 "title": "Überweisung vor Aufnahme einer Psychotherapie zur Abklärung somatischer Ursachen",
 "form_version": "10.2014",
 "released": "2014-09-01",
 "status": "entwurf",
 "paper": {
  "format": "DIN A5 quer",
  "width": 595.3,
  "height": 419.5,
  "tint": "rot"
 },
 "copies": [
  {
   "id": "7",
   "label": "Überweisung",
   "recipient": "Konsiliararzt (Überweisung des Psychotherapeuten zur Abklärung somatischer Ursachen)"
  }
 ],
 "notes": [
  {
   "id": "m07.zweck",
   "text": "Vor Antragstellung eines Patienten auf Kurzzeit- oder Langzeittherapie muss der Therapeut zunächst abklären lassen, ob somatische Erkrankungen vorliegen. Dafür wird Muster 7 benutzt.",
   "source": {
    "artifact": "erlaeuterungen",
    "locator": "Muster 7, Nr. 1, S. 30"
   }
  },
  {
   "id": "m07.konsiliararzt",
   "text": "Welche Vertragsärzte zur Abfassung eines Konsiliarberichts berechtigt sind, legt die Psychotherapie-Richtlinie fest.",
   "source": {
    "artifact": "erlaeuterungen",
    "locator": "Muster 7, Nr. 2, S. 30"
   }
  },
  {
   "id": "m07.hinweis_frist",
   "text": "Aufdruck: Der Konsiliarbericht ist dem Psychotherapeuten möglichst zeitnah, spätestens drei Wochen nach der Untersuchung zu übermitteln.",
   "source": {
    "artifact": "mustersammlung",
    "locator": "PDF-Seite 12, Muster 7 (10.2014)"
   }
  }
 ],
 "groups": [],
 "fields": [
  {
   "id": "personalien",
   "label": "Personalienfeld (Krankenkasse bzw. Kostenträger, Name, geb. am, Kostenträgerkennung, Versicherten-Nr., Status, BSNR, LANR, Datum)",
   "kind": "personalien",
   "filled_by": "duria",
   "box": {
    "x": 4.3,
    "y": 3.4,
    "w": 38.0,
    "h": 31.7
   },
   "rules": [
    {
     "id": "m07.ausfuellen",
     "text": "Der Therapeut liest die elektronische Gesundheitskarte ein und füllt das Diagnosen-/Indikationsfeld aus; weitergehende Informationen für den Konsiliararzt kann er zusätzlich eintragen.",
     "source": {
      "artifact": "erlaeuterungen",
      "locator": "Muster 7, Nr. 2, S. 30"
     }
    }
   ]
  },
  {
   "id": "diagnosen",
   "label": "Diagnosen/Indikation zur Psychotherapie",
   "kind": "text",
   "filled_by": "arzt",
   "lines": 3,
   "box": {
    "x": 47.2,
    "y": 18.0,
    "w": 47.6,
    "h": 17.2
   },
   "rules": [
    {
     "id": "m07.ausfuellen",
     "text": "Der Therapeut liest die elektronische Gesundheitskarte ein und füllt das Diagnosen-/Indikationsfeld aus; weitergehende Informationen für den Konsiliararzt kann er zusätzlich eintragen.",
     "source": {
      "artifact": "erlaeuterungen",
      "locator": "Muster 7, Nr. 2, S. 30"
     }
    }
   ]
  },
  {
   "id": "information",
   "label": "Information für den Arzt",
   "kind": "text",
   "filled_by": "arzt",
   "lines": 5,
   "box": {
    "x": 4.3,
    "y": 38.0,
    "w": 90.5,
    "h": 27.5
   },
   "rules": [
    {
     "id": "m07.ausfuellen",
     "text": "Der Therapeut liest die elektronische Gesundheitskarte ein und füllt das Diagnosen-/Indikationsfeld aus; weitergehende Informationen für den Konsiliararzt kann er zusätzlich eintragen.",
     "source": {
      "artifact": "erlaeuterungen",
      "locator": "Muster 7, Nr. 2, S. 30"
     }
    }
   ]
  },
  {
   "id": "ausstellungsdatum",
   "label": "Ausstellungsdatum",
   "kind": "date",
   "filled_by": "praxis",
   "format": "TTMMJJ",
   "box": {
    "x": 55.1,
    "y": 88.0,
    "w": 14.5,
    "h": 4.3
   },
   "rules": [
    {
     "id": "m07.datum",
     "text": "Ausstellungsdatum der Überweisung im Datumsfeld (TTMMJJ).",
     "source": {
      "artifact": "mustersammlung",
      "locator": "PDF-Seite 12, Muster 7 (10.2014)"
     }
    }
   ]
  },
  {
   "id": "stempel",
   "label": "Stempel / Unterschrift des Therapeuten",
   "kind": "stempel",
   "filled_by": "arzt",
   "box": {
    "x": 73.4,
    "y": 68.0,
    "w": 22.8,
    "h": 24.2
   },
   "rules": [
    {
     "id": "m07.unterschrift",
     "text": "Erst vollständig ausfüllen, dann mit Stempel persönlich unterschreiben – nie blanko.",
     "source": {
      "artifact": "erlaeuterungen",
      "locator": "Allgemeines Nr. 2 und Nr. 5, S. 5"
     }
    }
   ]
  }
 ]
}